{
  "architecture_mode": "runtime_adaptive",
  "controller_configuration": {
    "illegal_mode_action": "force_safe_fallback",
    "metadata_protection": "triplicated",
    "safe_fallback_config_id": "sec-ded-64",
    "transition_commit_condition": "target region quiesced and migrated data verified"
  },
  "hardware_topology": "gated_parallel",
  "metadata_format": {
    "illegal_mode_action": "force_safe_fallback",
    "mode_bits": 3,
    "mode_encoding": "binary",
    "protection": "triplicated",
    "protection_factor": 3,
    "stored_bits": 9
  },
  "mode_policy": {
    "heavy-fault-regime": "taec-64",
    "moderate-high-carbon": "bch-63-51-t2",
    "moderate-low-carbon": "bch-63-51-t2"
  },
  "provenance": {
    "input_config": "C:\\Users\\Abhinav\\OneDrive\\Desktop\\ECC\\Error-Code-Correction\\configs\\architecture_dse.example.json",
    "input_config_sha256": "6cadb92c19ee976b363a337a5deab02d37ebd3cc4b54b0c7a7ad240f4f63e503",
    "repository_commit": "31f6a8482c3d595d244545e4730bfc355d7af530",
    "repository_dirty": true,
    "result_run_id": "c610d8b930fd5cf0",
    "source_tree_sha256": "f6d10ab0db1917e0a4733ccaf519004427e9605a7b976bd4a262a58cb632ac44"
  },
  "register_map": {
    "ECC_MODE": {
      "access": "RW",
      "offset": "0x00",
      "reset": "sec-ded-64"
    },
    "ECC_MODE_STATUS": {
      "access": "RO",
      "offset": "0x04"
    },
    "ECC_TRANSITION_REQUEST": {
      "access": "WO",
      "offset": "0x08"
    },
    "ECC_TRANSITION_STATUS": {
      "access": "RO",
      "offset": "0x0C"
    }
  },
  "safe_fallback_config_id": "sec-ded-64",
  "scenario_decisions": {
    "heavy-fault-regime": {
      "architecture_breakdown": {
        "carbon": {
          "absolute_system_carbon_kgco2e": null,
          "amortized_incremental_carbon_kgco2e_per_access": null,
          "base_system_carbon_kgco2e": 115.72816724450263,
          "embodied_detail": null,
          "incremental_embodied_carbon_kgco2e": null,
          "incremental_operational_carbon_kgco2e": null,
          "incremental_total_carbon_kgco2e": null,
          "operational_equation": "CI[kgCO2e/kWh] * energy[J] / 3.6e6"
        },
        "fabric": {
          "area_um2_total": null,
          "dynamic_energy_j_per_operation_total": null,
          "leakage_power_w_total": null,
          "max_path_delay_ns": null,
          "mux_2to1_count_total": 784,
          "paths": [
            {
              "area_um2": null,
              "delay_ns": null,
              "depth": 3,
              "dynamic_energy_j_per_operation": null,
              "implementation": "pruned",
              "leakage_power_w": null,
              "modes": 5,
              "mux_2to1_count": 512,
              "name": "write_codeword_mux",
              "physical_metrics_characterized": false,
              "width_bits": 128
            },
            {
              "area_um2": null,
              "delay_ns": null,
              "depth": 3,
              "dynamic_energy_j_per_operation": null,
              "implementation": "pruned",
              "leakage_power_w": null,
              "modes": 5,
              "mux_2to1_count": 256,
              "name": "read_data_mux",
              "physical_metrics_characterized": false,
              "width_bits": 64
            },
            {
              "area_um2": null,
              "delay_ns": null,
              "depth": 3,
              "dynamic_energy_j_per_operation": null,
              "implementation": "pruned",
              "leakage_power_w": null,
              "modes": 5,
              "mux_2to1_count": 16,
              "name": "read_status_mux",
              "physical_metrics_characterized": false,
              "width_bits": 4
            }
          ],
          "physical_metrics_characterized": false
        },
        "layout": {
          "container_bits": 128,
          "entries": [
            {
              "capacity_efficiency": 0.5,
              "codewords_per_logical_word": 1,
              "config_id": "sec-ded-64",
              "container_bits": 128,
              "family": "SEC-DED",
              "k": 64,
              "n": 72,
              "padding_bits": 56,
              "physical_bits_used": 72
            },
            {
              "capacity_efficiency": 0.5,
              "codewords_per_logical_word": 1,
              "config_id": "sec-daec-64",
              "container_bits": 128,
              "family": "SEC-DAEC",
              "k": 64,
              "n": 73,
              "padding_bits": 55,
              "physical_bits_used": 73
            },
            {
              "capacity_efficiency": 0.5,
              "codewords_per_logical_word": 1,
              "config_id": "taec-64",
              "container_bits": 128,
              "family": "TAEC",
              "k": 64,
              "n": 75,
              "padding_bits": 53,
              "physical_bits_used": 75
            },
            {
              "capacity_efficiency": 0.5,
              "codewords_per_logical_word": 2,
              "config_id": "bch-63-51-t2",
              "container_bits": 128,
              "family": "BCH",
              "k": 51,
              "n": 63,
              "padding_bits": 2,
              "physical_bits_used": 126
            },
            {
              "capacity_efficiency": 0.5,
              "codewords_per_logical_word": 2,
              "config_id": "polar-64-48-sc",
              "container_bits": 128,
              "family": "POLAR",
              "k": 48,
              "n": 64,
              "padding_bits": 0,
              "physical_bits_used": 128
            }
          ],
          "layout": "fixed_nmax_physical_slot",
          "logical_width_bits": 64
        },
        "metadata": {
          "mode_bits": 3,
          "protection": "triplicated",
          "protection_factor": 3,
          "stored_bits": 9
        },
        "reliability_fault_tree": {
          "assumption": "Independent failure events; disabled terms are omitted, not assumed zero.",
          "system_failure_probability": 0.02271733759223593,
          "terms": {
            "ecc": 0.02271733759223593,
            "metadata": 0.0
          }
        }
      },
      "baseline_regret": {
        "exact_pareto_preference": {
          "absolute_regret": 0.0,
          "preference_cost": 0.0
        },
        "fault_regime_lookup": {
          "absolute_regret": 0.052884650437492964,
          "preference_cost": 0.052884650437492964
        },
        "green_ecc_policy": {
          "absolute_regret": 0.0,
          "preference_cost": 0.0
        },
        "minimum_carbon_feasible": {
          "absolute_regret": 0.0,
          "preference_cost": 0.0
        },
        "minimum_energy_feasible": {
          "absolute_regret": 0.0,
          "preference_cost": 0.0
        },
        "static_secded": {
          "absolute_regret": 0.4444444444444444,
          "preference_cost": 0.4444444444444444
        },
        "strongest_reliability": {
          "absolute_regret": 0.0,
          "preference_cost": 0.0
        }
      },
      "constraint_margins": {},
      "constraint_violations": [],
      "counterfactual": {
        "active_objectives": [
          "FIT"
        ],
        "fault_regime_lookup": "bch-63-51-t2",
        "green_ecc": "taec-64",
        "reason": "Exact modeled reliability changes the choice; adaptive physical PPA is uncharacterized, so this is not evidence of a lifecycle-carbon advantage.",
        "scenario_id": "heavy-fault-regime"
      },
      "recommendation_confidence": 0.6166666666666667,
      "reconfiguration": {
        "amortized_energy_j_per_access": null,
        "control_energy_j": null,
        "energy_j_total": null,
        "latency_ns_total": null,
        "migrated_words_per_transition": 1048576,
        "migrated_words_total": 24117248,
        "migration_energy_j": 1939.5359781220734,
        "model": "N_migrated * (legacy old per-access energy + legacy new per-access energy) + control; read/decode and encode/write are not separable in current legacy energy records.",
        "new_encode_write_energy_j_per_word_proxy": 4.6559592972288e-05,
        "old_read_decode_energy_j_per_word_proxy": 3.3861522161664e-05,
        "temporary_capacity_bits": 134217728,
        "transitions": 23
      },
      "runner_up_config_id": "bch-63-51-t2",
      "selected_config_id": "taec-64"
    },
    "moderate-high-carbon": {
      "architecture_breakdown": {
        "carbon": {
          "absolute_system_carbon_kgco2e": null,
          "amortized_incremental_carbon_kgco2e_per_access": null,
          "base_system_carbon_kgco2e": 126.61077731508632,
          "embodied_detail": null,
          "incremental_embodied_carbon_kgco2e": null,
          "incremental_operational_carbon_kgco2e": null,
          "incremental_total_carbon_kgco2e": null,
          "operational_equation": "CI[kgCO2e/kWh] * energy[J] / 3.6e6"
        },
        "fabric": {
          "area_um2_total": null,
          "dynamic_energy_j_per_operation_total": null,
          "leakage_power_w_total": null,
          "max_path_delay_ns": null,
          "mux_2to1_count_total": 784,
          "paths": [
            {
              "area_um2": null,
              "delay_ns": null,
              "depth": 3,
              "dynamic_energy_j_per_operation": null,
              "implementation": "pruned",
              "leakage_power_w": null,
              "modes": 5,
              "mux_2to1_count": 512,
              "name": "write_codeword_mux",
              "physical_metrics_characterized": false,
              "width_bits": 128
            },
            {
              "area_um2": null,
              "delay_ns": null,
              "depth": 3,
              "dynamic_energy_j_per_operation": null,
              "implementation": "pruned",
              "leakage_power_w": null,
              "modes": 5,
              "mux_2to1_count": 256,
              "name": "read_data_mux",